{
  "template_id": "vocabulary-pastel-v1",
  "duration_seconds": 10,
  "brand_handle": "@english.daily.vn",
  "word": "resilient",
  "ipa": "/rɪˈzɪl.i.ənt/",
  "part_of_speech": "adjective",
  "meaning_vi": "kiên cường; nhanh chóng phục hồi sau khó khăn",
  "example_en": "She stayed resilient after the setback.",
  "example_vi": "Cô ấy vẫn kiên cường sau trở ngại.",
  "cta": "Follow @english.daily.vn • 1 từ mỗi ngày",
  "pronunciation_audio_url": null,
  "background_music_url": null
}
